{
  "capabilities": [
    {
      "contract": {
        "input": {
          "properties": {
            "limit": {
              "items": {
                "type": "integer"
              },
              "type": "array"
            }
          },
          "type": "object"
        },
        "selection": "one"
      },
      "id": "secrets@acme-vault",
      "plugin": "acme-secrets",
      "realizations": [
        {
          "builds_on": null,
          "default": true,
          "effects": [],
          "name": "env-file",
          "realizes": null,
          "runs": "agent"
        }
      ],
      "version": "1.0.0"
    }
  ],
  "graphHash": "sha256:77e834d225d235e1c55d0869dc5fc52bfc2ce790dd6bfd68af8bd18bd417ca23",
  "graphSpecVersion": "1.0",
  "marketplace": "acme-vault",
  "nodes": [],
  "upstreams": []
}
