{
  "capabilities": [
    {
      "contract": {
        "input": {
          "properties": {
            "limit": {
              "items": {
                "type": "integer"
              },
              "type": "array",
              "uniqueItems": true
            }
          },
          "type": "object"
        },
        "selection": "one"
      },
      "id": "secrets@acme-vault",
      "plugin": "acme-secrets",
      "realizations": [
        {
          "builds_on": null,
          "default": true,
          "effects": [],
          "name": "env-file",
          "realizes": null,
          "runs": "agent"
        }
      ],
      "version": "1.0.0"
    }
  ],
  "graphHash": "sha256:294b1fd567284433cf5f8186c97a700dda3b2854d02394f9126a6c4957f0ffa0",
  "graphSpecVersion": "1.0",
  "marketplace": "acme-vault",
  "nodes": [],
  "upstreams": []
}
