{
  "capabilities": [
    {
      "contract": {
        "input": {
          "properties": {
            "limit": {
              "exclusiveMinimum": 0,
              "type": "number"
            }
          },
          "type": "object"
        },
        "selection": "one"
      },
      "id": "secrets@acme-vault",
      "plugin": "acme-secrets",
      "realizations": [
        {
          "builds_on": null,
          "default": true,
          "effects": [],
          "name": "env-file",
          "realizes": null,
          "runs": "agent"
        }
      ],
      "version": "1.0.0"
    }
  ],
  "graphHash": "sha256:ba34e7847c6bd8b5cf3e82fb2b0681e9b548742ccd1322d0b4a4096452adb2c6",
  "graphSpecVersion": "1.0",
  "marketplace": "acme-vault",
  "nodes": [],
  "upstreams": []
}
